{"schemaVersion":1,"artifactType":"traffic-program/v1","compileTarget":"traffic-runtime/v1","layoutId":"c61ed79ca3a77ce9cf67e141ce72b3d12860e49343cf049691f12f43875f61c3","totalShare":10000,"hashAlgorithm":"traffic.hash.v1","policyId":"ta-traffic-smoke-redirect-v2","contextRegistryVersion":1,"contentRegistryVersion":2,"scenarios":[{"id":"landing","kind":"render","slotIds":["gallery","handoff.from_landing","handoff.from_mirror_1","handoff.from_mirror_2","skin"]},{"id":"redirect","kind":"redirect","slotIds":["target"]}],"variants":[{"id":"disabled_dsp","typeId":"dsp-handoff","schemaVersion":1,"handlerVersion":"dsp-handoff-v1","payload":{"dspId":"disabled_dsp","enabled":false}},{"id":"disabled_target","typeId":"redirect-target","schemaVersion":2,"handlerVersion":"redirect-target-v2","payload":{"enabled":false,"targetId":"disabled_target"}},{"id":"glass_right_form","typeId":"landing-skin","schemaVersion":1,"handlerVersion":"landing-skin-v1","payload":{"skinId":"glass_right_form"}},{"id":"home-kitchen","typeId":"landing-gallery","schemaVersion":1,"handlerVersion":"landing-gallery-v1","payload":{"galleryId":"home-kitchen"}},{"id":"home-sauna-swimwear","typeId":"landing-gallery","schemaVersion":1,"handlerVersion":"landing-gallery-v1","payload":{"galleryId":"home-sauna-swimwear"}},{"id":"home-sauna-towel-wave","typeId":"landing-gallery","schemaVersion":1,"handlerVersion":"landing-gallery-v1","payload":{"galleryId":"home-sauna-towel-wave"}},{"id":"kitchen-swimwear","typeId":"landing-gallery","schemaVersion":1,"handlerVersion":"landing-gallery-v1","payload":{"galleryId":"kitchen-swimwear"}},{"id":"minimal_center","typeId":"landing-skin","schemaVersion":1,"handlerVersion":"landing-skin-v1","payload":{"skinId":"minimal_center"}},{"id":"smartlink-main","typeId":"redirect-target","schemaVersion":2,"handlerVersion":"redirect-target-v2","payload":{"enabled":true,"targetId":"smartlink-main","url":"https://example.com/?campaign=contract-smoke"}},{"id":"velvet_left_form","typeId":"landing-skin","schemaVersion":1,"handlerVersion":"landing-skin-v1","payload":{"skinId":"velvet_left_form"}}],"vectors":[{"distributionKey":"landing.gallery.default","choiceDomain":"VARIANT","choiceIds":["home-kitchen","home-sauna-swimwear","home-sauna-towel-wave","kitchen-swimwear"]},{"distributionKey":"landing.handoff.from_landing.default","choiceDomain":"VARIANT","choiceIds":["disabled_dsp"]},{"distributionKey":"landing.handoff.from_mirror_1.default","choiceDomain":"VARIANT","choiceIds":["disabled_dsp"]},{"distributionKey":"landing.handoff.from_mirror_2.default","choiceDomain":"VARIANT","choiceIds":["disabled_dsp"]},{"distributionKey":"landing.skin.default","choiceDomain":"VARIANT","choiceIds":["glass_right_form","minimal_center","velvet_left_form"]},{"distributionKey":"landing.skin.rule.mobile-minimal","choiceDomain":"VARIANT","choiceIds":["minimal_center"]},{"distributionKey":"redirect.target.default","choiceDomain":"VARIANT","choiceIds":["disabled_target","smartlink-main"]},{"distributionKey":"scenario.default","choiceDomain":"SCENARIO","choiceIds":["landing","redirect"]},{"distributionKey":"scenario.rule.bots-redirect","choiceDomain":"SCENARIO","choiceIds":["redirect"]},{"distributionKey":"scenario.rule.ru-landing-only","choiceDomain":"SCENARIO","choiceIds":["landing"]}],"scenarioProgram":{"decisionScopeId":"scenario","assignmentKey":"SUBJECT_ID","salt":"scenario-v1","missingAssignmentChoiceId":"redirect","rules":[{"ruleId":"bots-redirect","when":{"op":"CONDITION","field":"isBot","operator":"EQ","value":true},"branch":{"vectorIndex":8}},{"ruleId":"ru-landing-only","when":{"op":"CONDITION","field":"country","operator":"EQ","value":"RU"},"branch":{"vectorIndex":9}}],"defaultBranch":{"vectorIndex":7}},"slotPrograms":[{"scenarioId":"landing","slotId":"gallery","typeId":"landing-gallery","schemaVersion":1,"program":{"decisionScopeId":"landing.gallery","assignmentKey":"SUBJECT_ID","salt":"gallery-v1","missingAssignmentChoiceId":"home-kitchen","rules":[],"defaultBranch":{"vectorIndex":0}}},{"scenarioId":"landing","slotId":"handoff.from_landing","typeId":"dsp-handoff","schemaVersion":1,"program":{"decisionScopeId":"landing.handoff.from_landing","assignmentKey":"SUBJECT_ID","salt":"handoff-v1","missingAssignmentChoiceId":"disabled_dsp","rules":[],"defaultBranch":{"vectorIndex":1}}},{"scenarioId":"landing","slotId":"handoff.from_mirror_1","typeId":"dsp-handoff","schemaVersion":1,"program":{"decisionScopeId":"landing.handoff.from_mirror_1","assignmentKey":"SUBJECT_ID","salt":"handoff-v1","missingAssignmentChoiceId":"disabled_dsp","rules":[],"defaultBranch":{"vectorIndex":2}}},{"scenarioId":"landing","slotId":"handoff.from_mirror_2","typeId":"dsp-handoff","schemaVersion":1,"program":{"decisionScopeId":"landing.handoff.from_mirror_2","assignmentKey":"SUBJECT_ID","salt":"handoff-v1","missingAssignmentChoiceId":"disabled_dsp","rules":[],"defaultBranch":{"vectorIndex":3}}},{"scenarioId":"landing","slotId":"skin","typeId":"landing-skin","schemaVersion":1,"program":{"decisionScopeId":"landing.skin","assignmentKey":"SUBJECT_ID","salt":"skin-v1","missingAssignmentChoiceId":"velvet_left_form","rules":[{"ruleId":"mobile-minimal","when":{"op":"CONDITION","field":"deviceType","operator":"EQ","value":"mobile"},"branch":{"vectorIndex":5}}],"defaultBranch":{"vectorIndex":4}}},{"scenarioId":"redirect","slotId":"target","typeId":"redirect-target","schemaVersion":2,"program":{"decisionScopeId":"redirect.target","assignmentKey":"SUBJECT_ID","salt":"target-v1","missingAssignmentChoiceId":"disabled_target","rules":[],"defaultBranch":{"vectorIndex":6}}}]}
