{"schemaVersion":1,"artifactType":"traffic-program/v1","compileTarget":"traffic-runtime/v1","layoutId":"2cc224b0c63ec5466a0e9994e894cf475ab33075b2360cf9f22a6f9eda8c09fa","totalShare":10000,"hashAlgorithm":"traffic.hash.v1","policyId":"ta-traffic-hotlink-macros-v1","contextRegistryVersion":1,"contentRegistryVersion":1,"scenarios":[{"id":"redirect","kind":"redirect","slotIds":["target"]}],"variants":[{"id":"disabled_target","typeId":"redirect-target","schemaVersion":1,"handlerVersion":"redirect-target-v1","payload":{"enabled":false,"targetId":"disabled_target"}}],"vectors":[{"distributionKey":"redirect.target.default","choiceDomain":"VARIANT","choiceIds":["disabled_target"]},{"distributionKey":"redirect.target.rule.ta-source-eq-slot","choiceDomain":"VARIANT","choiceIds":["disabled_target"]},{"distributionKey":"scenario.default","choiceDomain":"SCENARIO","choiceIds":["redirect"]},{"distributionKey":"scenario.rule.hotlink-all-combo","choiceDomain":"SCENARIO","choiceIds":["redirect"]},{"distributionKey":"scenario.rule.hotlink-any-src-or-sub","choiceDomain":"SCENARIO","choiceIds":["redirect"]},{"distributionKey":"scenario.rule.hotlink-unblocked-source","choiceDomain":"SCENARIO","choiceIds":["redirect"]},{"distributionKey":"scenario.rule.ta-source-eq-ads","choiceDomain":"SCENARIO","choiceIds":["redirect"]},{"distributionKey":"scenario.rule.ta-source-exists","choiceDomain":"SCENARIO","choiceIds":["redirect"]},{"distributionKey":"scenario.rule.ta-source-in-partners","choiceDomain":"SCENARIO","choiceIds":["redirect"]},{"distributionKey":"scenario.rule.ta-sub-eq-main","choiceDomain":"SCENARIO","choiceIds":["redirect"]},{"distributionKey":"scenario.rule.ta-sub-exists","choiceDomain":"SCENARIO","choiceIds":["redirect"]},{"distributionKey":"scenario.rule.ta-sub-in-tags","choiceDomain":"SCENARIO","choiceIds":["redirect"]}],"scenarioProgram":{"decisionScopeId":"scenario","assignmentKey":"SUBJECT_ID","salt":"hotlink-v1","missingAssignmentChoiceId":"redirect","rules":[{"ruleId":"ta-source-eq-ads","when":{"op":"CONDITION","field":"ta_source","operator":"EQ","value":"ads"},"branch":{"vectorIndex":6}},{"ruleId":"ta-source-in-partners","when":{"op":"CONDITION","field":"ta_source","operator":"IN","values":["partner-a","partner-b"]},"branch":{"vectorIndex":8}},{"ruleId":"ta-sub-eq-main","when":{"op":"CONDITION","field":"ta_sub","operator":"EQ","value":"main"},"branch":{"vectorIndex":9}},{"ruleId":"ta-sub-in-tags","when":{"op":"CONDITION","field":"ta_sub","operator":"IN","values":["alpha","beta"]},"branch":{"vectorIndex":11}},{"ruleId":"hotlink-all-combo","when":{"op":"ALL","rules":[{"op":"CONDITION","field":"ta_source","operator":"EQ","value":"combo-src"},{"op":"CONDITION","field":"ta_sub","operator":"EQ","value":"combo-sub"}]},"branch":{"vectorIndex":3}},{"ruleId":"hotlink-any-src-or-sub","when":{"op":"ANY","rules":[{"op":"CONDITION","field":"ta_source","operator":"EQ","value":"any-src"},{"op":"CONDITION","field":"ta_sub","operator":"EQ","value":"any-sub"}]},"branch":{"vectorIndex":4}},{"ruleId":"hotlink-unblocked-source","when":{"op":"ALL","rules":[{"op":"CONDITION","field":"ta_source","operator":"EXISTS"},{"op":"NOT","rule":{"op":"CONDITION","field":"ta_source","operator":"EQ","value":"blocked"}}]},"branch":{"vectorIndex":5}},{"ruleId":"ta-source-exists","when":{"op":"CONDITION","field":"ta_source","operator":"EXISTS"},"branch":{"vectorIndex":7}},{"ruleId":"ta-sub-exists","when":{"op":"CONDITION","field":"ta_sub","operator":"EXISTS"},"branch":{"vectorIndex":10}}],"defaultBranch":{"vectorIndex":2}},"slotPrograms":[{"scenarioId":"redirect","slotId":"target","typeId":"redirect-target","schemaVersion":1,"program":{"decisionScopeId":"redirect.target","assignmentKey":"SUBJECT_ID","salt":"target-v1","missingAssignmentChoiceId":"disabled_target","rules":[{"ruleId":"ta-source-eq-slot","when":{"op":"CONDITION","field":"ta_source","operator":"EQ","value":"slot-src"},"branch":{"vectorIndex":1}}],"defaultBranch":{"vectorIndex":0}}}]}
